Pozițiile fundamentale sunt:;stând, pe genunchi, culcat, mers, atârnat;stând, așezat, pe genunchi, culcat, atârnat;stând, culcat, pe vârfuri, așezat, sărit;B
Poziția stând se mai numește:;poziția de relaxare completă;poziția de echilibru lateral;poziția aliniamentului ortostatic;C
În poziția stând, privirea este orientată:;în jos;lateral;anterior;C
În poziția stând, brațele sunt:;ridicate deasupra capului;relaxate lângă corp;întinse lateral;B
În poziția stând, palmele se află în:;supinație totală;poziție intermediară de pronosupinație;pronatie completă;B
În poziția stând, coapsele și genunchii sunt:;extinși;flexați;depărtați;A
În poziția stând, o variantă este:;călcâiele se apropie, iar vârfurile se depărtează la un unghi;călcâiele și vârfurile depărtate complet;călcâiele și vârfurile ridicate;A
Poziția stând se caracterizează prin:;bază de susținere medie;bază mai mare de susținere;cea mai mică bază de susținere;C
Poziția stând determină:;blocarea respirației;instabilitate completă;stabilitate mai bună a corpului spre anterior;C
Poziția stând solicită:;muşchi ai gâtului şi trunchiului;musculatura posturală şi reflexele respective;muşchi abdominali;B
În poziția așezat, genunchii trebuie să fie:;extinși complet;ușor depărtați;ridicați de pe sol;B
Poziția așezat are:;bază mai mare de susținere;cea mai mică bază de susținere;nu are bază de susținere;A
În poziția așezat, stabilitatea corpului este mai bună spre:;anterior;lateral;posterior;A
Poziția decubit dorsal se realizează cu:;membrele inferioare apropiate, extinse din șold și genunchi;membrele inferioare depărtate, genunchii flectați;membrele inferioare în flexie completă;A
În poziția decubit dorsal, vârfurile picioarelor sunt orientate:;lateral;în jos;în sus;C
Punctele de sprijin în decubit dorsal sunt:;umerii, genunchii și călcâiele;partea dorsală a gambelor și vârfurile picioarelor;regiunea occipitală, partea dorso-superioară a trunchiului, regiunea fesieră și călcâie;C
Poziția decubit dorsal are:;bază medie de susținere;cea mai mică bază de susținere;bază mare de susținere;C
Poziția decubit dorsal are centrul de greutate:;la mijlocul corpului;foarte aproape de suprafața de sprijin;ridicat față de sol;B
Menținerea îndelungată a poziției decubit dorsal induce:;tonifierea spatelui;efecte osteoporozante generale;creșterea masei musculare;B
Poziția atârnat blochează:;mișcările ample ale trunchiului;respirația în inspir și stânjenește circulația;mobilitatea membrelor inferioare;B
Pozițiile derivate se obțin din pozițiile fundamentale prin modificarea:;bazei de susținere, poziției trunchiului și/sau a capului, poziției membrelor superioare și inferioare, combinații parțiale sau totale ale posibilităților anterioare;doar poziției membrelor superioare și inferioare;doar poziției trunchiului și a capului;A
Modificarea bazei de susținere în poziția stând poate fi:;stând pe vârfuri, călcâie, pe marginea internă sau externă a piciorului;stând cu genunchii flectați complet;stând cu picioarele depărtate complet și brațele încrucișate;A
Modificarea poziției trunchiului în poziția stând poate fi:;cu trunchiul aplecat anterior până la 30° sau 90°, cu trunchiul îndoit anterior peste 90°;cu trunchiul complet în extensie și picioarele flectate;cu trunchiul rotit posterior la 180°;A
Poziția stând cu trunchiul și capul în extensie este:;poziția fundamentală standard;poziția așezat cu trunchiul sprijinit;una dintre variantele de poziții derivate din stând;C
Modificarea poziției membrelor superioare în stând poate consta în:;membrele superioare se mențin obligatoriu pe coapse;membrele superioare sunt întotdeauna întinse lateral;membrele superioare cu coatele extinse se mențin lateral sau anterior, se flectează din coate, iar mâinile se mențin pe umeri, la ceafă, pe vertex;C
Poziția atârnat se caracterizează prin:;centrul de greutate este situat deasupra capului;centrul de greutate este pe partea laterală a corpului;centrul de greutate este situat sub suprafața de sprijin;C
Poziția așezat pe podea este o variantă de:;poziție de sprijin în mers;poziție fundamentală de relaxare;poziție derivată din poziția fundamentală așezat;C
În poziția așezat pe podea, coapsele și genunchii pot fi:;extinși complet;în aer fără sprijin;flectați;C
În poziția pe genunchi cu sprijin pe palme și trunchiul la orizontală, poziția se numește:;atârnat cu sprijin;patrupedie;decubit ventral;B
Poziția patrupedie se folosește frecvent în recuperare datorită:;blocării complete a mobilității trunchiului;suprafeței mari de sprijin, centrului de greutate în poziție medie (stabilitate relativă), eliberării coloanei;solicitării intense a mușchilor spatelui;B
decubit lateral este o poziție stabilă pentru că:;se realizează sprijinul pe umeri și călcâie;centrul de greutate este foarte sus;are bază mare de susținere și centrul de greutate jos situat;C
decubit ventral are:;centrul de greutate situat la nivelul umerilor;cea mai mică bază de susținere;bază mare de susținere și centrul de greutate aproape de suprafața de sprijin;C
În poziția decubit dorsal, membrele superioare pot fi:;cu coatele extinse, brațele depărtate de trunchi (abduse);flectate și sprijinite pe coapse;obligatoriu întinse pe lângă trunchi;A
În decubit dorsal, o variantă este:;mâinile pe vertex, umeri, sub axile, pe șold;membrele superioare sprijinite pe coapse;sprijin pe genunchi și coate;A
O modificare complexă în decubit lateral este:;trunchiul și capul înclinate posterior;cu genunchii flectați, trunchiul în rectitudine, capul flectat, sprijinit pe antebrațul de partea decubitului;cu membrele inferioare extinse complet și brațele lateral;B
O altă variantă complexă în decubit dorsal este:;cu picioarele depărtate și brațele lateral;cu trunchiul complet în extensie și mâinile pe șold;cu genunchii flectați, sprijin pe plante, mâinile la ceafă;C
În decubit ventral cu sprijin pe coate și trunchiul și capul în extensie, poziția se numește:;poziție de relaxare completă;poziție suspendată;postură a păpușii;C
În poziția pe genunchi cu sprijin pe palme și trunchiul sub orizontală, poziția se numește:;patrupedie;decubit dorsal;atârnat cu sprijin;A
Poziția patrupedie are:;centru de greutate situat la nivelul umerilor;cea mai mică bază de susținere și centru de greutate foarte sus;suprafață mare de sprijin și centru de greutate în poziție medie (stabilitate relativă);C
În poziția pe genunchi, trunchiul și capul pot fi:;înclinate lateral dreapta sau stânga;obligatoriu în rectitudine;flectate posterior;A
Modificarea suprafeței de sprijin în poziția atârnat poate consta în:;sprijinul se face obligatoriu pe vârfurile picioarelor;sprijinul se face doar pe coapse;sprijinul se realizează cu o mână orientată în pronație sau supinație sau cu două mâini, dar cu menținerea coatelor în flexie;C
În poziția atârnat cu fața la spalier, mâinile sunt:;în pronație;în poziție intermediară;în supinație;A
În poziția atârnat, trunchiul poate fi:;flectat complet anterior;înclinat posterior peste 90°;extins, înclinat sau răsucit dreapta-stânga;C
Modificarea poziției membrelor superioare în atârnat reprezintă de fapt:;modificarea suprafeței de sprijin;modificarea centrului de greutate;modificarea trunchiului;A
În poziția atârnat, membrele inferioare pot fi:;flectate doar din genunchi;în extensie completă, obligatorie;depărtate (abduse), încrucișate (adduse), flectate din șold și genunchi;C
O modificare complexă în atârnat este:;mâinile în supinație, trunchiul flectat, capul în rectitudine, membrele inferioare aduse;membrele inferioare complet depărtate și trunchiul în extensie;trunchiul complet în extensie și brațele lateral;A
În poziția atârnat cu mâinile în pronație, trunchiul și capul pot fi:;răsucite dreapta-stânga;flectate anterior;obligatoriu în extensie completă;A
În poziția atârnat cu membrele inferioare, genunchii și șoldurile flectate la 90°, membrele superioare sunt:;în pronație;întinse lateral;în supinație;A
În poziția decubit dorsal cu membrele inferioare depărtate la diverse amplitudini, aceasta reprezintă:;modificare a poziției membrelor superioare;modificare a suprafeței de sprijin;modificare a poziției membrelor inferioare;C
O poziție complexă în decubit lateral este:;cu trunchiul și capul complet înclinate posterior;cu membrele superioare pe șold;cu membrul inferior controlateral în flexie, trunchiul în rectitudine, capul în extensie;C
Modificarea poziției membrelor superioare în decubit dorsal poate consta în:;membrele superioare obligatoriu pe lângă trunchi;cu coatele extinse, brațele depărtate de trunchi (abduse);brațele întinse complet pe șold;B
În decubit dorsal, o variantă este:;mâinile pe vertex, umeri, sub axile, pe șold;membrele superioare întinse lateral;palmele obligatoriu în pronație;A
În decubit dorsal cu membrele superioare încrucișate anterior, se modifică:;poziția membrelor inferioare;poziția membrelor superioare;poziția trunchiului;B
În decubit lateral cu genunchii flectați, trunchiul în rectitudine și capul flectat, sprijinul se realizează pe:;genunchi;antebrațul de partea decubitului (cotul flectat);umeri;B
În decubit dorsal cu genunchii flectați, sprijin pe plante și mâinile la ceafă, poziția este:;poziție instabilă;poziție fundamentală;modificare complexă;C
Decubit lateral cu membrul inferior controlateral în flexie, trunchiul în rectitudine și capul în extensie este:;poziție de sprijin pe genunchi;poziție de relaxare;o modificare complexă;C
Decubit ventral cu sprijin pe coate, trunchiul și capul în extensie se numește:;poziție patrupedie;poziție așezat;postură a păpușii;C
Postura a păpușii este folosită pentru:;tonificarea mușchilor extensori ai cefei, spatelui și șoldului;blocarea respirației;relaxarea completă a musculaturii;A
În poziția atârnat cu o mână orientată în pronație sau supinație, se modifică:;poziția membrelor inferioare;poziția trunchiului;suprafața de sprijin;C
Sprijinul pe vârful picioarelor în poziția atârnat reprezintă:;modificare a suprafeței de sprijin;modificare a poziției trunchiului;modificare a poziției membrelor inferioare;A
În poziția atârnat cu fața la spalier, trunchiul poate fi:;complet flectat anterior;extins, înclinat sau răsucit dreapta-stânga;obligatoriu în extensie;B
Modificarea poziției membrelor superioare în atârnat înseamnă:;modificarea trunchiului;modificarea centrului de greutate;modificarea suprafeței de sprijin;C
În poziția atârnat, membrele inferioare pot fi:;membrele superioare obligatoriu pe lângă trunchi;în extensie completă și depărtate;depărtate (abduse), încrucișate (adduse), flectate din șold și genunchi;C
În atârnat cu mâinile în supinație, trunchiul flectat și capul în rectitudine, membrele inferioare sunt:;adduse;sprijinite pe sol;depărtate complet;A
În poziția atârnat cu mâinile în pronație, trunchiul și capul pot fi:;răsucite dreapta-stânga;înclinate posterior peste 90°;obligatoriu în extensie;A
În poziția atârnat cu genunchii și șoldurile flectate la 90°, membrele inferioare sunt:;flectate din șold și genunchi;în extensie completă;depărtate;A
În poziția pe genunchi cu sprijin pe palme, trunchiul deasupra orizontalei și capul flectat, mâna și genunchiul de aceeași parte sunt:;depărtate complet;sprijinite pe podea;situate anterior;C
În poziția pe genunchi cu sprijin pe coate, trunchiul este:;în extensie completă;deasupra orizontalei;sub orizontală;C
În poziția pe genunchi cu sprijin pe un genunchi, celălalt membru inferior este:;flectat complet și sprijinit pe sol;depărtat lateral;extins din șold și genunchi;C
Poziția pe genunchi depărtat cu trunchiul în extensie este:;o modificare complexă;poziție de relaxare completă;poziție fundamentală;A
Inclinometrul mecanic indică:;doar verticala;atât verticala, cât și înclinarea;doar înclinarea;B
Precizia inclinometrului mecanic este:;de ordinul a 5°;de ordinul a 10°;de ordinul a 2°;C
Baza inclinometrului are rolul de a:;conferi stabilitate;bloca mișcarea;permite rotirea liberă;A
Cele două coloane culisante ale bazei inclinometrului permit:;măsurarea lungimii membrelor;măsurarea amplitudinii de mișcare în articulații mici;măsurarea forței musculare;B
Fixarea unui braț telescopic pe fiecare parte a bazei transformă inclinometrul în:;goniometru cu braț;dinamometru digital;aparat de forță;A
Prin comparație cu goniometria, inclinometria este:;neutilizată în practică;mai rapidă, mai simplă, mai precisă;mai greoaie și mai puțin precisă;B
Un inclinometru digital poate înregistra:;doar pe hârtie, manual;doar valorile estimate vizual;valorile electronic, cu senzori și ecrane de afișare;C
Transmitatorul wireless al inclinometrului digital permite:;conectarea la computer;autonomie completă fără baterii;control vocal;A
Datele măsurate de inclinometru pot fi afișate:;numai în format audio;doar în format text;sub formă de diagrame;C
Un dublu inclinometru măsoară:;doar un singur sens de mișcare;forța musculară în stare de repaus;simultan amplitudinea unei mișcări pereche;C
Avantajul principal al inclinometrului digital este:;ușurința în transport;prețul redus;precizia mare, eroare de numai 0,1°;C
Un dezavantaj al inclinometrului digital este:;nu oferă valori precise;necesită calibrare la fiecare utilizare;nu se poate utiliza în clinici;B
Calibrarea inclinometrului se face în funcție de:;timpul de utilizare;greutatea pacientului;un reper sigur perfect vertical sau orizontal;C
Învățarea motrică este:;un proces pur teoretic;o caracteristică nativă;un set de procese asociate exersării și experienței;C
Învățarea motrică conduce la:;schimbări relativ permanente în comportamentul motric;modificări temporare de dispoziție;creșterea greutății corporale;A
O zonă importantă în care operează învățarea motrică este:;zona de identificare a stimulilor;zona de control digestiv;zona respiratorie;A
Învățarea motrică se produce ca rezultat direct al:;odihnei prelungite;evitării activității fizice;exersării și al experienței;C
Învățarea motrică determină:;creșterea înălțimii cu 5 cm;modificări la nivel celular în sistemul nervos;modificarea structurii osoase externe;B
Odată dobândită, învățarea motrică este:;relativ permanentă;neinfluentabilă;temporară, maxim o oră;A
Învățarea motrică se exprimă prin:;creșteri cantitative și calitative care favorizează viitoarele repetări;blocaje ale mișcării;scăderi ale capacității fizice;A
Un efect al învățării motrice este:;încetinirea reacțiilor;atrofierea musculaturii;organizarea informației senzoriale;C
În învățarea motrică se construiesc:;blocaje reflexe;imobilizări voluntare;programe motori eficiente;C
Învățarea motrică implică:;creșterea automată a masei musculare;modificări la nivelul altor structuri care nu pot fi examinate cu ochiul liber;rigidizarea articulațiilor;B
În etapele avansate ale învățării motrice se stabilește:;blocarea reacțiilor posturale;imobilizarea membrelor;corectitudinea mișcărilor;C
Învățarea motrică determină:;imposibilitatea de a gestiona mișcările;schimbări temporare și nesemnificative;o modificare durabilă a individului;C
Învățarea motrică nu este:;un proces observabil direct;un fenomen fiziologic;un rezultat al experienței;A
În timpul învățării motrice, informația senzorială:;se organizează în mod specific;se blochează;se pierde complet;A
În procesul de învățare motrică se îmbunătățesc:;parametrii care se atașează programului motor general;reflexele digestive;abilitățile cognitive abstracte;A
Învățarea motrică implică:;îmbogățirea circuitelor neuromotorii;reducerea numărului de conexiuni nervoase;atrofierea sistemului muscular;A
Dobândirea unei deprinderi motrice eficiente este posibilă prin:;odihnă pasivă prelungită;evitarea antrenamentului;exersare și experiență;C
Goniometria impune respectarea următoarelor condiții:;poziția subiectului obligatoriu în picioare;poziția subiectului comodă și relaxantă;poziția subiectului cu genunchii flectați;B
Raportorul în goniometrie se plasează:;în planul mișcării;pe planul sagital;pe planul coronal;A
Axul goniometrului se poziționează:;în afara axului biomecanic;în axul biomecanic al mișcării;pe partea externă a articulației;B
Brațele goniometrului se așază:;în unghi drept față de segmente;paralel cu axele longitudinale ale segmentelor care formează unghiul articular;oblic pe segmente;B
Brațul fix al goniometrului se aplică:;pe segmentul mobil;pe segmentul opus articulației;pe segmentul de referință;C
Brațul mobil al goniometrului se aplică:;în afara segmentelor;pe segmentul de referință;pe segmentul mobil, însoțind mișcarea;C
Testările se realizează:;exclusiv prin contracții izometrice;prin mobilizări active sau pasive;doar prin mobilizări pasive;B
În cazul mobilizărilor active, subiectul execută mișcarea:;numai cu sprijin pe sol;doar pasiv, asistat de kinetoterapeut;în amplitudinea posibilă, în timp ce kinetoterapeutul deplasează brațul mobil;C
Valorile obținute la măsurători se exprimă:;în grade de la 0-180°;în centimetri;în kilograme;A
Orice mișcare articulară se încadrează:;între 0-90°;între 0-360°;între limitele 0-180°;C
În scoliozele sub 30°, tratamentul este:;exclusiv kinetic;ortopedic și chirurgical;chirurgical;A
Scoliozele peste 30°, înainte de maturitate osoasă, sunt:;nerelevante clinic;foarte stabile;aproape toate evolutive;C
Scoliozele peste 50° impun:;imobilizare completă;doar kinetoterapie;intervenție chirurgicală;C
În perioada inițială a scoliozei, agravarea este:;relativ lentă;absentă;foarte rapidă;A
După apariția semnelor de pubertate, agravarea scoliozei:;crește de 2 până la 8 ori;se stabilizează complet;scade progresiv;A
Durerea la copil și adolescent cu scolioză:;este prezentă permanent;indică mereu tumori;lipsește;C
Tulburările cardiorespiratorii apar dacă unghiul curburii depășește:;50°;80-90°;40°;B
Tulburările neurologice apar mai ales în scoliozele dorsale cu unghi peste:;60°;30°;100°;C
Scolioza infantilă debutează:;după 12 ani;între 4 și 12 ani;sub vârsta de 4 ani;C
Scolioza infantilă este de obicei:;toracică stângă;toracică dreaptă;lombară dreaptă;A
Scolioza juvenilă debutează între:;sub 4 ani;4 și 12 ani;12 și 16 ani;B
Scolioza adolescentină afectează mai ales:;copiii sub 4 ani;fetele;băieții;B
În scolioza adolescentină, coastele:;se dublează;se turtesc și se suprapun;se depărtează;B
În scolioza adolescentină, hemitoracele se transformă:;într-o regiune plată;într-o mare gibozitate;într-o proeminență lombară;B
Durerea la adult cu scolioză este:;inexistentă;frecventă;asociată cu creșterea înălțimii;B
Diagnosticul pozitiv al scoliozei se stabilește prin:;doar prin RMN;numai prin observație;metode subiective și obiective;C
Printre metodele subiective se află:;anamneza;CT-ul;radiografia;A
Somatoscopia instrumentală se realizează cu:;riglă și compas;fir cu plumb și/sau cadrul antropometric de simetrie;ecografie;B
Examenul clinic general analizează:;aliniamentele și ecoul deficienței;exclusiv greutatea corporală;doar înălțimea;A
La examinarea cu firul cu plumb, se elimină:;deseori efectul vestimentației;greutatea pacientului;orice asimetrie congenitală;A
Pozițiile derivate se obțin din pozițiile fundamentale prin modificarea:;doar poziției membrelor inferioare;doar poziției trunchiului și capului;bazei de susținere, poziției trunchiului și/sau a capului, poziției membrelor superioare și inferioare, combinații parțiale sau totale ale posibilităților anterioare;C
Modificarea bazei de susținere în poziția stând poate fi:;stând pe vârfuri, călcâie, pe marginea internă sau externă a piciorului;stând pe palme;stând pe genunchi;A
Modificarea poziției trunchiului și a capului în stând poate fi:;stând cu trunchiul rotit 180°;stând cu capul complet în flexie;stând cu trunchiul înclinat anterior (până la 30°), cu capul în extensie;C
Modificarea poziției membrelor superioare în stând poate fi:;membrele superioare cu coatele extinse se mențin lateral sau anterior, se flectează din coate, iar mâinile se mențin pe umeri, la ceafă, pe vertex;membrele superioare doar lateral;obligatoriu pe lângă corp;A
Poziția decubit dorsal se caracterizează prin:;cea mai mică bază de susținere;centrul de greutate situat foarte sus;bază de susținere mare, centrul de greutate foarte aproape de suprafața de sprijin;C
În poziția decubit dorsal, menținerea îndelungată induce:;tonifiere musculară;efecte osteoporozante generale;creșterea masei musculare;B
Poziția atârnat se caracterizează prin:;centrul de greutate proiectat lateral;centrul de greutate este situat sub suprafața de sprijin;centrul de greutate situat foarte sus;B
În poziția atârnat, membrele superioare sunt:;abduse peste 90° din umăr, coatele extinse, mâinile prind bara, fiind orientate în pronație sau supinație;menținute pe umeri;obligatoriu flectate;A
Poziția așezat derivată poate presupune:;așezat exclusiv pe un genunchi;așezat pe marginea mesei de reeducare;obligatoriu pe podea;B
În poziția așezat derivată, trunchiul poate fi:;doar în extensie;în extensie sau aplecat peste coapse sau între coapse;obligatoriu în flexie maximă;B
Modificarea poziției membrelor superioare în așezat poate fi:;membrele superioare cu coatele extinse se mențin lateral sau anterior, se flectează din coate, iar mâinile se mențin pe umeri, la ceafă, pe vertex;membrele superioare doar lateral;membrele superioare doar pe coapse;A
În poziția pe genunchi derivată, membrele inferioare pot fi:;depărtate sau cu un genunchi anterior față de celălalt;obligatoriu apropiate;complet încrucișate;A
O modificare complexă în poziția pe genunchi este:;obligatoriu sprijin pe coate;cu sprijin pe palme, trunchiul deasupra orizontalei, capul flectat, mâna și genunchiul de aceeași parte sau de partea opusă situate anterior;trunchiul complet în extensie;B
Deficiențele tridimensionale ale coloanei vertebrale sunt reprezentate de:;scolioze;lordoze;cifoze;A
Scoliozele se consideră deficiențe tridimensionale pentru că:;prezintă deviații în cele trei planuri anatomice: frontal, transversal și sagital;afectează doar planul frontal;afectează doar planul sagital;A
Scolioza în C poate fi:;obligatoriu cu trei curburi;doar totală;unică, totală sau parțială;C
În scolioza în C când afectează coloana dorsală, hemitoracele de partea convexității:;se îngustează;nu se modifică;se lărgește;A
Scolioza în C poate evolua spre:;hiperextensie;scolioză în S;lordoză;B
Apariția celei de-a treia încurbări în scolioză se produce:;doar prin traumatisme;obligatoriu prin malformații;datorită aceleași cauze;C
Denumirea scoliozei ține cont de:;orientarea convexității încurbării;numărul vertebrelor implicate;vârsta pacientului;A
În cazul scoliozei cu mai multe încurbări, se denumește:;mai întâi sensul curburii primitive și apoi cel al curburilor secundare;doar curbura lombară;doar curbura cea mai mare;A
Tratamentul scoliozei funcționale constă în:;imobilizare completă;doar tratament medicamentos;înlăturarea cauzei generatoare;C
Un exemplu de cauză generatoare în scolioză funcțională este:;poziția șezândă;sprijinul unipodal prelungit;efort fizic excesiv;B
Pentru inegalitatea lungimii membrelor inferioare se folosește:;aparat gipsat;talonetă (înălțător);corset;B
Mijloacele kinetice în tratamentul scoliozei se sistematizează în:;exerciții statice, dinamice și masaj;doar exerciții pasive;doar masaj;A
Tratamentul scoliozelor structurate este:;mult mai complex: medicamentos, ortopedic și/sau chirurgical, completat prin kinetoterapie;exclusiv kinetic;numai chirurgical;A
În scolioza în S se fixează o curbură cu ajutorul:;membrelor inferioare pentru curbura cervicală;membrelor superioare pentru curbura dorsală și membrelor inferioare pentru curbura lombară;membrelor inferioare pentru curbura dorsală;B
Tonifierea fără mobilizare în tratamentul scoliozei duce la:;consolidarea și fixarea deficienței;mobilizarea excesivă;corectarea completă;A
Mobilizarea fără tonifiere în tratamentul scoliozei:;accentuează curbura;duce la rigidizare;elimină curbura;A
Tratamentul deficiențelor tridimensionale ale coloanei vertebrale trebuie:;individualizat în funcție de tipul, forma, numărul și localizarea încurbărilor vertebrale;standardizat pentru toți pacienții;bazat exclusiv pe medicamente;A
Inegalitatea lungimii membrelor inferioare determină:;lordoză lombară;cifoză toracală;scolioză funcțională;C
Dacă scolioza dispare la corectarea inegalității membrelor, înseamnă că:;este consecința inegalității;are cauză congenitală;este patologică;A
Dacă scolioza persistă după corectarea inegalității membrelor, înseamnă că:;problema este strict musculară;tulburarea mecanică inițială are sediul la nivelul bazinului;există o malformație congenitală;B
Examinările din pozițiile decubit și atârnat permit:;diagnosticul diferențial între atitudinile scoliotice și scoliozele adevărate;prevenirea scoliozei;corectarea scoliozei;A
În scoliozele adevărate, curburile:;persistă;se reduc complet;dispar complet;A
